question_id,scene,floor,question,answer
00823-7MXmsvcQjpJ:q001,00823-7MXmsvcQjpJ,0,What is in the right corner of the room downstairs?,A bookshelf
00823-7MXmsvcQjpJ:q002,00823-7MXmsvcQjpJ,0,Is the china cabinet full?,Yes.
00823-7MXmsvcQjpJ:q003,00823-7MXmsvcQjpJ,0,Are the dining table chairs pushed in?,Yes.
00823-7MXmsvcQjpJ:q004,00823-7MXmsvcQjpJ,0,Where should I look if I want to research a topic?,The bookshelf in the office room downstairs
00823-7MXmsvcQjpJ:q005,00823-7MXmsvcQjpJ,0,Does this house have a backyard?,Yes
00823-7MXmsvcQjpJ:q006,00823-7MXmsvcQjpJ,0,Where is the drawing of the airpline?,In the picture frame along the stairway
