question_id,scene,floor,question,answer
00827-BAbdmeyTvMZ:q001,00827-BAbdmeyTvMZ,0,what is on the chair?,a soft pillow
00827-BAbdmeyTvMZ:q002,00827-BAbdmeyTvMZ,0,what is right next to the chair?,a small side table
00827-BAbdmeyTvMZ:q003,00827-BAbdmeyTvMZ,0,is the outside door open or closed?,open
00827-BAbdmeyTvMZ:q004,00827-BAbdmeyTvMZ,0,is the table in the living room clean?,yes
00827-BAbdmeyTvMZ:q005,00827-BAbdmeyTvMZ,0,is the outside door open or closed?,open
00827-BAbdmeyTvMZ:q006,00827-BAbdmeyTvMZ,0,where can I sit in the living room?,on the sofa
00827-BAbdmeyTvMZ:q007,00827-BAbdmeyTvMZ,0,what is special about the wall in the living room?,it seems to be made of stone
00827-BAbdmeyTvMZ:q008,00827-BAbdmeyTvMZ,0,where is the standing lamp?,next to the bed in the bedroom
