question_id,scene,floor,question,answer
00886-TPhiubUHKcP:q001,00886-TPhiubUHKcP,0,"What is the large, round
00886-TPhiubUHKcP,0,What shape are the door knobs?,Round or spherical
00886-TPhiubUHKcP,0,What type of flooring does this house feature?,Wood panels
00886-TPhiubUHKcP,0,What is to the left of the mirror?,A plant in a tall vase
00886-TPhiubUHKcP,0,What is to the left of the staircase?,A storage closet
00886-TPhiubUHKcP,0,Are the cabinets below the mirror closed?,Yes.
00886-TPhiubUHKcP,0,Is the bedroom door open?,Yes
00886-TPhiubUHKcP,0,Where is the mirror?,Next to the staircase above the dark brown cabinet",None
